
<QuestDialog xmlns="https://vezel.dev/novadrop/dc/QuestDialog" xmlns:xsi="http://www.w3.org/2001/XMLSchema-instance" xsi:schemaLocation="https://vezel.dev/novadrop/dc/QuestDialog QuestDialog.xsd" id="93" huntingZoneId="28" voiceTypeId="0">
    <Text huntingZoneId="0" id="1" prevId="0" villagerId="0" />
    <Text huntingZoneId="70" id="100" prevId="0" villagerId="1017">
         
         
        <Page social="0" />
    
    
    </Text>
    <Text huntingZoneId="70" id="2" prevId="0" villagerId="1017">
         
         
        <Page social="0">Esses malditos ataques de oriscos estão prejudicando os esforços de recuperação. Não vou permitir isso. Mate {@LinkCreature:28#3021#reeking orisks} e recolha suas carapaças. Sinta-se à vontade para fazê-los sofrer um pouco.&lt;BR&gt;&lt;BR&gt;Relate a Laneama quando a missão estiver concluída.</Page>
    
    
    </Text>
    <Text huntingZoneId="228" id="3" prevId="2" villagerId="1004">
         
         
        <Page social="5">Um bom trabalho merece ser recompensado. Obrigado a você.</Page>
    
    
    </Text>
    <Text huntingZoneId="228" id="4" villagerId="1004">
         
         
        <Page social="0">Até que os oriscos sejam repelidos, não vou entregar a recompensa.</Page>
    
    
    </Text>
</QuestDialog>
