<?xml version='1.0' encoding='utf-8'?>
<QuestDialog xmlns="https://vezel.dev/novadrop/dc/QuestDialog" xmlns:xsi="http://www.w3.org/2001/XMLSchema-instance" xsi:schemaLocation="https://vezel.dev/novadrop/dc/QuestDialog QuestDialog.xsd" huntingZoneId="121" id="16" voiceTypeId="0">
    <Text huntingZoneId="0" id="1" prevId="0" villagerId="0" />
    <Text huntingZoneId="63" id="100" prevId="0" villagerId="22002">
         
        <Page social="0" />
    
    </Text>
    <Text huntingZoneId="63" id="2" prevId="0" villagerId="22002">
         
        <Page social="1">O que precisamos é de troféus de escalão. Infelizmente, você precisará se espalhar pelo mundo para encontrá-los.&lt;BR&gt;&lt;BR&gt;Tente estes lugares:&lt;BR&gt;&lt;BR&gt;Balder's Temple (Normal)-{@linkcreature:425#8005#Auricadis}&lt;BR&gt;Balder's Temple (1 pessoa)-{@linkcreature:825#6000#Nightmare Glaciernus}&lt;BR&gt;Manaya's Core-{@linkcreature:727#2007#Shandra Manaya}</Page>
    
    </Text>
    <Text huntingZoneId="63" id="3" prevId="2" villagerId="22002">
         
        <Page social="4">Que bom - esse token nos ajudará a nos tornarmos a potência mais rica que este mundo já viu!</Page>
    
    </Text>
    <Text huntingZoneId="63" id="4" villagerId="22002">
         
        <Page social="0">Para obter lucro!</Page>
    
    </Text>
</QuestDialog>