<?xml version="1.0" encoding="utf-8"?>
<QuestDialog xmlns="https://vezel.dev/novadrop/dc/QuestDialog" xmlns:xsi="http://www.w3.org/2001/XMLSchema-instance" xsi:schemaLocation="https://vezel.dev/novadrop/dc/QuestDialog QuestDialog.xsd" huntingZoneId="31" id="37" voiceTypeId="0">
    <Text huntingZoneId="0" id="1" prevId="0" villagerId="0" />
    <Text huntingZoneId="231" id="100" prevId="0" villagerId="1042">
         
        <Page social="0" />
    
    </Text>
    <Text huntingZoneId="231" id="2" prevId="0" villagerId="1042">
         
        <Page social="4">It's difficult to detect the silent movements of the {@LinkCreature:31#8#sepulchral wraiths} and {@LinkCreature:31#9#souleater wraiths}. That's one reason they've killed so many. Please eliminate these creatures for the safety of the coastal villagers.</Page>
    
    </Text>
    <Text huntingZoneId="231" id="3" prevId="2" villagerId="1042">
         
        <Page social="4">Good work. You can't imagine how many lives you have saved.</Page>
    
    </Text>
</QuestDialog>
