<?xml version='1.0' encoding='utf-8'?>
<QuestDialog xmlns="https://vezel.dev/novadrop/dc/QuestDialog" xmlns:xsi="http://www.w3.org/2001/XMLSchema-instance" xsi:schemaLocation="https://vezel.dev/novadrop/dc/QuestDialog QuestDialog.xsd" huntingZoneId="55" id="92" voiceTypeId="0">
    <Text huntingZoneId="0" id="1" prevId="0" villagerId="0" />
    <Text huntingZoneId="80" id="100" prevId="0" villagerId="1012">
         
        <Page social="0" />
    
    </Text>
    <Text huntingZoneId="80" id="2" prevId="0" villagerId="1012">
         
        <Page social="0">As coisas estão difíceis na Floresta de Darkquaver. Parece que tudo se voltou contra nós.&lt;BR&gt;&lt;BR&gt;Preciso que você mate {@LinkCreature:56#16#Hienas de Darkquaver}, {@LinkCreature:56#17#Cavalos-marinhos-de-razortusk}, {@LinkCreature:55#1#Caminhantes-espinhosos-malucos} e {@LinkCreature:55#11#Unicórnios-prateados}.&lt;BR&gt;&lt;BR&gt;Apresentar-se à Belva na Guarnição de Darkquaver quando a missão estiver concluída.</Page>
    
    </Text>
    <Text huntingZoneId="255" id="3" prevId="2" villagerId="1011">
         
        <Page social="4">Você recebeu os agradecimentos da federação!</Page>
    
    </Text>
    <Text huntingZoneId="255" id="4" villagerId="1011">
         
        <Page social="0">Parece que você ainda não completou sua missão.</Page>
    
    </Text>
</QuestDialog>