<?xml version='1.0' encoding='utf-8'?>
<QuestDialog xmlns="https://vezel.dev/novadrop/dc/QuestDialog" xmlns:xsi="http://www.w3.org/2001/XMLSchema-instance" xsi:schemaLocation="https://vezel.dev/novadrop/dc/QuestDialog QuestDialog.xsd" huntingZoneId="36" id="37" voiceTypeId="0">
    <Text huntingZoneId="0" id="1" prevId="0" villagerId="0" />
    <Text huntingZoneId="236" id="100" prevId="0" villagerId="1017">
         
        <Page social="0" />
    
    </Text>
    <Text huntingZoneId="236" id="2" prevId="0" villagerId="1017">
         
        <Page social="5">Você já ouviu falar que Killian está fazendo uma lavagem cerebral nos mercenários de Tenebrara, certo? &lt;BR&gt;&lt;BR&gt;Bem, assim que conseguimos controlar essa situação, ele intensificou seu jogo.&lt;BR&gt;&lt;BR&gt;É difícil, mas até agora, estamos aguentando.&lt;BR&gt;&lt;BR&gt;Agora ele transformou os lanceiros e feiticeiros, então os mais poderosos são também os mais perigosos para nós.&lt;BR&gt;&lt;BR&gt;Você pode nos ajudar?</Page>
    
    </Text>
    <Text huntingZoneId="236" id="3" prevId="2" villagerId="1017">
         
        <Page social="18">Não tenho palavras para descrever a pressão que você aliviou. Obrigado, &lt;PCNAME&gt;.&lt;BR&gt;&lt;BR&gt;E aqui está algo para você.</Page>
    
    </Text>
</QuestDialog>