<?xml version='1.0' encoding='utf-8'?>
<QuestDialog xmlns="https://vezel.dev/novadrop/dc/QuestDialog" xmlns:xsi="http://www.w3.org/2001/XMLSchema-instance" xsi:schemaLocation="https://vezel.dev/novadrop/dc/QuestDialog QuestDialog.xsd" huntingZoneId="55" id="31" voiceTypeId="0">
    <Text huntingZoneId="0" id="1" prevId="0" villagerId="0" />
    <Text huntingZoneId="255" id="100" prevId="0" villagerId="1015">
         
        <Page social="0" />
    
    </Text>
    <Text huntingZoneId="255" id="2" prevId="0" villagerId="1015">
         
        <Page social="4">O caminho para o Cajado de Isren está bloqueado por orisks. Eles normalmente não são encontrados nessa área, então alguém quer que fiquemos o mais longe possível do cajado.&lt;BR&gt;&lt;BR&gt;Precisamos chegar ao cajado. Não me importa se você os atrai com bolinhos de vapor e uísque de fogo, mas vivos ou mortos, eles têm que ir.</Page>
    
    </Text>
    <Text huntingZoneId="255" id="3" prevId="2" villagerId="1015">
         
        <Page social="4">Ainda bem que você não desperdiçou comida ou bebida com os oriscos. As rações estão um pouco escassas ultimamente. As pessoas poderiam tê-lo matado por causa do uísque de fogo.</Page>
    
    </Text>
</QuestDialog>