<?xml version='1.0' encoding='utf-8'?>
<QuestDialog xmlns="https://vezel.dev/novadrop/dc/QuestDialog" xmlns:xsi="http://www.w3.org/2001/XMLSchema-instance" xsi:schemaLocation="https://vezel.dev/novadrop/dc/QuestDialog QuestDialog.xsd" huntingZoneId="35" id="93" voiceTypeId="0">
    <Text huntingZoneId="0" id="1" prevId="0" villagerId="0" />
    <Text huntingZoneId="74" id="100" prevId="0" villagerId="1019">
         
        <Page social="0" />
    
    </Text>
    <Text huntingZoneId="74" id="2" prevId="0" villagerId="1019">
         
        <Page social="5">&lt;BR&gt;&lt;BR&gt;Oh, desculpe. Pensei que você tivesse dito algo. Continuo ouvindo coisas ultimamente.&lt;BR&gt;&lt;BR&gt;De qualquer forma, você tem alguns Tenebrara {@LinkCreature:35#20#overseers}, {@LinkCreature:35#18#destroyers} e {@LinkCreature:35#17#dreadweavers} para cuidar. Tente não... o quê? &lt;BR&gt;&lt;BR&gt;Oh... desculpe, outra coisa de novo. De qualquer forma, tente não se divertir demais.&lt;BR&gt;&lt;BR&gt;Fale com...fale com Tesran em Wyrmgorge quando terminar.</Page>
    
    </Text>
    <Text huntingZoneId="235" id="3" prevId="2" villagerId="1015">
         
        <Page social="5">Aqui está sua recompensa.&lt;BR&gt;&lt;BR&gt;Continue assim.</Page>
    
    </Text>
    <Text huntingZoneId="235" id="4" villagerId="1015">
         
        <Page social="0">Você está aqui para receber uma recompensa? Por não ter concluído sua missão? Tente novamente.</Page>
    
    </Text>
</QuestDialog>