<?xml version="1.0" encoding="utf-8"?>
<QuestDialog xmlns="https://vezel.dev/novadrop/dc/QuestDialog" xmlns:xsi="http://www.w3.org/2001/XMLSchema-instance" xsi:schemaLocation="https://vezel.dev/novadrop/dc/QuestDialog QuestDialog.xsd" huntingZoneId="6" id="93" voiceTypeId="0">
    <Text huntingZoneId="0" id="1" prevId="0" villagerId="0" />
    <Text huntingZoneId="206" id="100" prevId="0" villagerId="1021">
         
        <Page social="0" />
    
    </Text>
    <Text huntingZoneId="206" id="2" prevId="0" villagerId="1021">
         
        <Page social="0">The bear population is becoming, well, unbearable. They've got to go.&lt;BR&gt;&lt;BR&gt;Hunt some {@LinkCreature:6#2041#ravenous bears} and thin out their numbers.&lt;BR&gt;&lt;BR&gt;Report to Miljean at Vindicator Camp when your mission is complete.</Page>
    
    </Text>
    <Text huntingZoneId="206" id="3" prevId="2" villagerId="1009">
         
        <Page social="5">Thank you for your hard work!</Page>
    
    </Text>
    <Text huntingZoneId="206" id="4" villagerId="1009">
         
        <Page social="0">It doesn't look like you've completed your mission yet.</Page>
    
    </Text>
</QuestDialog>
