<?xml version="1.0" encoding="utf-8"?>
<QuestDialog xmlns="https://vezel.dev/novadrop/dc/QuestDialog" xmlns:xsi="http://www.w3.org/2001/XMLSchema-instance" xsi:schemaLocation="https://vezel.dev/novadrop/dc/QuestDialog QuestDialog.xsd" huntingZoneId="47" id="22" voiceTypeId="0">
    <Text huntingZoneId="0" id="1" prevId="0" villagerId="0" />
    <Text huntingZoneId="77" id="100" prevId="0" villagerId="1010">
         
        <Page social="0" />
    
    </Text>
    <Text huntingZoneId="77" id="2" prevId="0" villagerId="1010">
         
        <Page social="4">I don't know if it's a good idea, but due to the shortage of rations around here, folks are talking about eating {@Creature:47#1001$$Tirkai grizzly} meat.&lt;BR&gt;&lt;BR&gt;I guess if we salted it enough it would likely eliminate any argon contamination.&lt;BR&gt;&lt;BR&gt;Take some to Jadora at Field Base Lunacy. She has access to lots of salt.</Page>
    
    </Text>
    <Text huntingZoneId="247" id="3" prevId="2" villagerId="1001">
         
        <Page social="4">She thinks salt will make it safe, huh? We could sure use an alternate source of food around here. I'll give it a go.</Page>
    
    </Text>
    <Text huntingZoneId="247" id="4" villagerId="1001">
         
        <Page social="0">I have salt. What did you say you need it for? I don't see any meat.</Page>
    
    </Text>
</QuestDialog>
