<?xml version='1.0' encoding='utf-8'?>
<QuestDialog xmlns="https://vezel.dev/novadrop/dc/QuestDialog" xmlns:xsi="http://www.w3.org/2001/XMLSchema-instance" xsi:schemaLocation="https://vezel.dev/novadrop/dc/QuestDialog QuestDialog.xsd" huntingZoneId="63" id="33" voiceTypeId="0">
    <Text huntingZoneId="0" id="1" prevId="0" villagerId="0" />
    <Text huntingZoneId="63" id="100" prevId="0" villagerId="3005">
         
        <Page social="0" />
    
    </Text>
    <Text huntingZoneId="63" id="2" prevId="0" villagerId="3005">
         
        <Page social="5">A menos que você tenha um pedaço de couro eldritch escondido em algum lugar, nem pergunte. Não posso fazer as cartolas sem o couro, e o couro não pode ser encontrado em lugar nenhum.&lt;NEXTPAGEBUTTON&gt;&amp;quot;Eu tenho o couro.&amp;quot;&lt;/NEXTPAGEBUTTON&gt;</Page>
    
    </Text>
    <Text huntingZoneId="63" id="3" prevId="2" villagerId="3005">
         
        <Page social="5">Uau, você realmente tinha algum? &lt;BR&gt;&lt;BR&gt;Bem, tudo bem, então! Que chapéu espetacular combina melhor com você? &lt;NEXTPAGEBUTTON&gt;&amp;quot;Deixe-me ver sua seleção.</Page>
    
    </Text>
    <Text huntingZoneId="63" id="4" villagerId="3005">
         
        <Page social="0">Se você precisa de couro eldritch, está sem sorte. Confie em mim, apenas jogue seu couro de sangue e couro bruto no mercado e corte suas perdas.</Page>
    
    </Text>
</QuestDialog>