<?xml version="1.0" encoding="utf-8"?>
<QuestDialog xmlns="https://vezel.dev/novadrop/dc/QuestDialog" xmlns:xsi="http://www.w3.org/2001/XMLSchema-instance" xsi:schemaLocation="https://vezel.dev/novadrop/dc/QuestDialog QuestDialog.xsd" huntingZoneId="4" id="95" voiceTypeId="0">
    <Text huntingZoneId="0" id="1" prevId="0" villagerId="0" />
    <Text huntingZoneId="61" id="100" prevId="0" villagerId="1016">
         
        <Page social="0" />
    
    </Text>
    <Text huntingZoneId="61" id="2" prevId="0" villagerId="1016">
         
        <Page social="4">The shurians and their blasted allies are wreaking havoc. We need you to put an end to their efforts.&lt;BR&gt;&lt;BR&gt;The {@LinkCreature:4#3031#tyraks}, {@LinkCreature:4#3041#shurian mindbenders}, and {@LinkCreature:4#3042#hellion thralls} must be slain.&lt;BR&gt;&lt;BR&gt;Report to Tifane at Firebase Valor when mission is complete.</Page>
    
    </Text>
    <Text huntingZoneId="204" id="3" prevId="2" villagerId="1006">
         
        <Page social="4">You've done really wonderful work here. We appreciate the help!</Page>
    
    </Text>
    <Text huntingZoneId="204" id="4" villagerId="1006">
         
        <Page social="0">You came to help, I assume? Maybe you should get to that.</Page>
    
    </Text>
</QuestDialog>
